poi_id;writer;keyword;wrating;wtime;mlocation;review;ids;titlen;mrating;mtipe;wlocation;mtotreview;wlocationlat;wlocationlong
78;Harlan D;;30;2015/12/16;-6.917269,107.61118;This is a state-run museum, so the quality of the facilities and services are not up to private-sector standard. However, for sheer historical regional-military facts, it has no peer. You can touch the old weapons, see old photographs and study old maps of army maneuvers. ;333435222;"The history of ""Siliwangi"", arguably... - Museum Mandala Wangsit";30;Specialty Museums, Museums ;Bandung, Indonesia;13;-6.917464;107.619123
78;Hosea Aryo Bimo... N;;30;2016/4/19;-6.917269,107.61118;It was a good place when you like to know more about the military history of Indonesia, especially the infamous 'Siliwangi Division' because they provided you with all you want to know about 'Siliwangi Division' from the formation, the tribulation years of 'Long March', the rebellion until now.The location is easy to found in which you can use 'The Telkom Building' and 'The Garang Asem Restaurant' as a marking point. The main building itself were stationed inside a small Militarized Zone belong to Siliwangi Division. The main enterance itself were at inside of the complex.Although under-maintained, the museum itself were quite good with a nice guide to hang around a bit [most of the guide were soldiers from Bintaldam 3 Siliwangi and they were open for a disscussion regarding military history].By the way, if you are lucky, there is two historical-based communities which have their basecamp on this museum which always has their meeting on specific days at the museum, the historical-reenactment-theme 'Historia van Bandoeng', and the old-bike-brotherhood 'Paguyuban Sapeda Bandoeng Baheula'I already going to those place a couple times, since the waroeng [small food stall] inside the museum serve good food;365547240;Mandala Wangsit Museum ~ for those who... - Museum Mandala Wangsit;30;Specialty Museums, Museums ;Indonesia;13;-0.789275;113.921327
134;Wanderer09;;20;2017/5/11;-6.878201,107.58756;A small art museum or gallery, has a quaint toy exhibition upstairs. There's a small cafe on the ground floor but the food is not remarkable. Not accessible to wheelchair-bound patrons - plenty of steps but no ramps or lifts.;483372879;Small museum - Museum Barli;20;;Singapore;1;1.352083;103.819836
82;DY_Moriniere;;40;2013/9/12;-6.8585,107.566475;Like :It has some rare butterflies and a very attentive caretaker. Unfortunately he only speak Bahasa so I have to re-translatefor my husband. But he's very passionate about his job and able to explain all stages of butterflies life, types and also their food in detail.The park where they put butterflies are full with flowers grown without pesticide.Dislike I wish the park is larger;176862568;Interesting and educating - Taman Kupu-Kupu Cihanjuang;30;Points of Interest & Landmarks, Sights & Landmarks ;Tremblay-En-France, France;16;48.979952;2.557211
82;Ms Lydia T;;30;2013/10/14;-6.8585,107.566475;Interesting: it is nice place with many butterflies..You can find really big butterfly named rama rama here.If you love to take picture, this is really nice place also because there are so many beautiful butterfly...;180892875;Interesting - Taman Kupu-Kupu Cihanjuang;30;Points of Interest & Landmarks, Sights & Landmarks ;Jakarta;16;-6.17511;106.865039
83;Lucifer M;;50;2017/9/25;-6.89215,107.61355;They have big size, thats what i need.Good quality tshirt,shirt and all trouser.i spent a couple bucks and it?s okay, because they sell good items;526673546;They have BiG Size - Blossom Factory Outlet;50;;Indonesia;4;-0.789275;113.921327
82;YuliaSyahrisada;;10;2014/3/9;-6.8585,107.566475;I knew this place from our local travel tv show. It looks like an ideal place to go with our 17m old. We got excited as reviewers here said that it's nice. So we head there on Saturday Mar 8th, 2014. The road to this place have steep climb. We tried to call to get directions but no phone was answered. And when we finally got there, they're CLOSED!There's a banner said that it's closed for renovation, but there's no activity whatsoever. So it's probably permanently closed. I don't know.;196820220;It's closed - Taman Kupu-Kupu Cihanjuang;30;Points of Interest & Landmarks, Sights & Landmarks ;Jakarta, Indonesia;16;-6.17511;106.865039
82;Anggi747;;30;2015/2/20;-6.8585,107.566475;Well, if you really want to see the complete collection from Indonesia's butterfly maybe you should choose Bogor Zoological Museum. But then i found this place as interesting place to visit. By its collection, you will learn the butterfly life cycle. I recommend to visit this place together with your children. There's also many beautiful butterfly flying around. Take picture as much as you want cause you will love it.;255535797;Educating Place - Taman Kupu-Kupu Cihanjuang;30;Points of Interest & Landmarks, Sights & Landmarks ;Jakarta, Indonesia;16;-6.17511;106.865039
85;Bachtiar K;;40;2016/1/17;-6.917332,107.609184;Having back to school shoes for growing up children, could be an ideal place, fair price, good brands,nice service, staffs are vey informative, good products knowledges;340816764;Quality Sporting Goods at Discount... - The Sports Warehouse;35;Factory Outlets, Shopping ;Bandung;13;-6.917464;107.619123
85;steven f;;20;2016/5/23;-6.917332,107.609184;Visited it 4 days ago. Like a huge store room. Stuffy. Goods outdated. Hugely disappointed. Complete waste of time. First and last visit.......;375985445;What Sports Warehouse????? - The Sports Warehouse;35;Factory Outlets, Shopping ;Bandung;13;-6.917464;107.619123
82;Eddy T;;30;2016/9/11;-6.8585,107.566475;Was there one time,second time went there was closed already.Actually nice place and see a collections of butterflies. ;417316608;Nice place - Taman Kupu-Kupu Cihanjuang;30;Points of Interest & Landmarks, Sights & Landmarks ;Jakarta, Indonesia;16;-6.17511;106.865039
124;Bolubulu;;10;2015/7/14;-7.122848,107.54491;We've tried to reach the place around 6pm (it started to get dark in there) but the road was stony. One of my friend's car couldnt reach there. The sign was also lacking, we had to asked several times, but still we couldn't reach there because we couldn't see the road further. It was too dark and scary.;289004962;Very hard to reach - Cibolang Hot Spring;30;Hot Springs & Geysers, Nature & Parks ;Jakarta, Indonesia;8;-6.17511;106.865039
85;ilham p;;30;2016/7/23;-6.917332,107.609184;The place is the same with Jakarta Sportwarehouse in POINS square Lb Bulus and Djakarta Theatre Central Jakarta. All branded products and price were inexpensinve (all discount up to 80%). Good place for purchase sport apparel and shoes. I love it;395923206;My visit Tuesday afternoon - The Sports Warehouse;35;Factory Outlets, Shopping ;Bandung;13;-6.917464;107.619123
86;eka n;;40;2017/6/13;-6.8585,107.566475;Travel here from bandung with friends. Take about 2 hour from center of bandung. We arrive at sunrise and get nice view of reflective lake, my pic will tell the rest.;492793576;Great View - Situ Cileunca;40;Bodies of Water, Nature & Parks ;Bandung, West Java ;6;-6.917464;107.619123
86;Asep H;;40;2017/3/19;-6.878201,107.58756;Situ Cileunca is offering the lake tour using the manual boat, some places can be visited at lakeside such as strowberry garden, dam, traditional restaurant and more, also you can try the wonderful arung jeram here, airsoft gun game, cow's milk, captive deer, etc;468501636;Cileunca lake with wonderful arung jeram - Situ Cileunca;40;Bodies of Water, Nature & Parks ;Bandung, West Java ;6;-6.917464;107.619123
117;KhalidfromBahrain;;30;2016/11/24;-6.99974,107.62021;Octopus house has lots of rumors and creepy stories to it and that's what drew me to it. Unfortunately it is quite difficult to find and access is a bit tough.Directions drive up the road towards the Grand Aquila hotel, just before you get to the hotel is a small narrow doorway a car can fit through. Drive straight through till the end of the road and turn right. Its house number 6 on the left right before the end of the street. You can't see the Octopus very clearly from here or from anywhere else for that matter. The owners of the house weren't home so i could not get a close look.Rumors talk about cult meetings, and spirits around, supposedly a haunted house. Or maybe its just a story to get you to come take a look. Cant be sure if any payment is required to get in, will have to try again next time I am in Bandung.If you get there before I do, let me know ??;439710915;A place with rumors and creepy to see - Octopus House;30;;Manama, Bahrain;1;26.228516;50.58605
115;Ferozeuddin;;30;2017/6/17;-6.891596,107.61283;Jalan Djuanda has several outlets and episode is one of them.I found the outlet a little disappointing as most of the material was sub standard. All that was not substandard was more expensive than the other outlets. I did not find anything exciting or any reason to spend more than a few minutes in the outlet.;493888755;Disappointing..... - Episode Factory Outlet;30;;Mumbai (Bombay), India;1;19.075984;72.877656
114;Ferozeuddin;;30;2017/6/17;-6.89267,107.61357;Glow is amongst the many clothing store / factory outlet in Dago, Jalan Djuanda. It is an average store. The goods offered aren't of a very high quality. There wasn't anything that really caught our attention.We were done in a few minutes.Nothing to write home about.;493890582;Average clothing store - Glow factory outlet;30;;Mumbai (Bombay), India;1;19.075984;72.877656
111;random_musings;;40;2015/6/4;-6.905555,107.6199;Located across from Heritage FO, Summit has a more local feel and is worth a quick peak. Hours are from 9am to 10pm;277989051;Quick Peak - Summit Factory Outlet;30;Factory Outlets, Department Stores, Shopping Malls, Shopping ;Singapore, Singapore;11;1.352083;103.819836
108;Riza_Ilyas;;50;2015/12/28;-6.891114,107.61718;When I visit Bandung at December, and pass Dipatiukur Road I was amaze with one spot which is located in front of Rabanni and Hotel D'Qur. Guess what? This very embarrassing small park now become a beautiful one. If I have a before-after picture you will see how different it is. This park 3 years ago was full of garbage and very messy. We can't enjoy this park like nowadays. But the local government makes up this messy spot into the catchy one. It is clean and supported with bench and many exercise tools. You can get more agile if you train here, like its name, Taman Gesit.Very great make over. I can't imagine this small messy park becomes a cool park nowadays. Enjoy the park if you visit Dipatiukur area, and become more agile.;335466128;Ready to More Agile in This Very... - Gesit Dipatiukur Park;40;;Jakarta, Indonesia;2;-6.17511;106.865039
109;Uncl3;;40;2017/2/1;-7.01847,107.60484;Tektona Waterpark gives the sensation of playing in the water with your family and friends, provide a joy to the kids and adults with modern facilities including Waves and Flow Pool, Swimming Kids and Toddlers Pool, Semi Olympic and Mini Slider for children and Mega slider for adults with 30 meters up in air, will trigger the adrenaline.This attraction it also provide culinary corner, gazebos and services and changing and wash room and lifeguards around the swimmers.Just a little note for management, they need to keep on eye with water quality when the their pool is fully loaded with visitors.I think this area will be good in the future after development are maintained.;456478687;Nice Waterpark! Love to swim.. - Tektona Waterpark;40;;Jakarta, Indonesia;1;-6.17511;106.865039
103;Algie A;;40;2016/7/12;-6.891699,107.60438;The mosque is the oldest mosque in Bandung (est. 1969), but pretty underrated.Many people think Cipaganti mosque is the oldest one (est. , though). Maybe because Cipaganti mosque's location much better than Mungsolakas mosque's.Its condition is really good and modest, due to renovation in 2009. The airflow is great, which cause a comfy cool air temperature inside. Also, the mosque become 'life' because many people do Shalat in this mosque.Located in a small alley, make it's hard to find this mosque.Having no park space, using a motorcycle, bike or on foot would be your best choice to visit this mosque. You can park your car in Advent Hospital park space, but you can't when it full.;391938042;Great mosque, great history, hard to... - Mungsolkanas Mosque;35;;Bandung, Indonesia;3;-6.917464;107.619123
102;Laura A;;40;2017/9/18;-6.890287,107.59691;KidZoo is a small zoo in the roof top of Paris van Java Shopping Mall. Surrounded with a flower garden, you can enjoy cool breeze of Bandung. It has cows, goats, sheeps, several kind of rabbits, guinea pig and mini hedgehog. You can bring your kids to feed the animals, the entry ticket includes 1 free animal meal. It was a nice experience to see kids are having outdoor activity and interact with animals.The great things about this place is you have everything in one place, the mall, the shops, the garden, and kids activity.;524890763;Mini Zoo in the city centre - KidZoo PVJ;45;;Jakarta, Indonesia;2;-6.17511;106.865039
102;Hanna1811;;50;2017/9/25;-6.890287,107.59691;We enjoy our time at KidZoo! The place is clean and the staffs are very friendly. The ticket is a DAY PASS so the the kids can take a lunch break and back to play. The animals look healthy.;526405020;Recommended and FUN - KidZoo PVJ;45;;Jakarta, Indonesia;2;-6.17511;106.865039
101;wmajid;;50;2017/10/9;-6.911733,107.61102;Good sceneries, good air, plantation tea, refreshing your lung and mind, nice people in and along the way, and better you go up north near to Cibolang spring after visiting this lake through pangalengan plantation and Cibolang hot all is just beautiful and refreshing. note : no public transport to this area.;530380821;0 km of Citarum River - Cisanti Lake;45;;Bandung, West Java ;2;-6.917464;107.619123
104;Ikin F;;50;2017/8/13;-6.99992,107.62595;Here, you can breathe fresh air. Go fishing. Eat fresh fish. Grill them by your own. Yummy! The best place for refreshing with friends.;512464178;Fresh air. Best choice for refreshing! - Pemancingan Mang Iing;50;;Bandung, West Java ;1;-6.917464;107.619123
111;shehnas a;;40;2015/9/24;-6.905555,107.6199;Third FO for the day!! And I still got as excited as the first two! Generally, I would have spent much more time here if not for the already long day we had! Pros: 1. Long shopping hours2. Close to money changer (behind the factory outlet) 3. In the heart of Jalan Riau (where all the factory outlets are -- Heritage, Secret, Passion)4. Good size of options for men. I did not even manage to cover the whole place, but it had a second level for men upstairs. 5. For women: kurti tops, long dresses, batik tops etc. I personally did not find anything much here for myself. Did more shopping for my brother (Fred Perry polo shirts that ranged from SGD 5.90 to SGD19.90) and dad! I mostly got perfume (Marc Jacobs, J.Lo, Escada) where prices ranged from SGD 3.70 to SGD 6.90. Sales girl said that these were original scent but just that they don't last as long. The scents that I purchased were the same as the original ones I got from Singapore. Good selection of Victoria Secrets' lingerie (think SGD19.90/set) :D Eyes glowww!! 6. There is a counter where you can exchange a token and placing your day's shopping at their counters. Free up the tension you have with wanting to keep an eye on them (all at your own risk of course). 7. Adjacent to the Summit FO, there are rows of shops (bazaar-like) selling Bandung souvenirs (t-shirts, handicrafts, magnets, keychains). I'm not too sure of their opening hours though as they are not fixed shops. Tip: Check in with your hotel to see if they provide some type of discount voucher for you (that can be used with a minimum purchase at one of these factory outlet stores). Tip is valid for other FO stores that I will be reviewing. :D Enjoy, ladies (and gentlemen)!!!;313314633;Shopping Experience at my first Factory... - Summit Factory Outlet;30;Factory Outlets, Department Stores, Shopping Malls, Shopping ;singapore;11;1.352083;103.819836
111;Desti P;;20;2015/7/14;-6.905555,107.6199;Actually the place is good, clothes are vary, but been here many times I rarely found something to buy. Maybe just not my type of store (clothes).;288756914;Not my type of store - Summit Factory Outlet;30;Factory Outlets, Department Stores, Shopping Malls, Shopping ;Singapore, Singapore;11;1.352083;103.819836
111;daryl652015;;10;2016/1/4;-6.905555,107.6199;Nothing to buy. Products were of poor quality and I don't understand why they are classified as Factory Outlet. Just a building selling cheap clothing's with no style, poor imitation goods and nothing to offer. A waste of time!;337426455;Waste of TIme - Summit Factory Outlet;30;Factory Outlets, Department Stores, Shopping Malls, Shopping ;Johor Bahru, Malaysia;11;1.492659;103.741359
111;Mari B;;30;2016/11/28;-6.905555,107.6199;Couldn't find anything I liked here.Disappointing. Seems like most of the stock in Bandung outlets are almost 10 years old;440802652;Nothing to buy - Summit Factory Outlet;30;Factory Outlets, Department Stores, Shopping Malls, Shopping ;Durbanville, South Africa;11;-33.825941;18.653191
111;Mudofir H;;10;2015/12/29;-6.905555,107.6199;Nothing to buy. The quality is not good. The price is quite expensive. Too crowded. The staff is not fri3ndly.;335620419;Nothing to buy - Summit Factory Outlet;30;Factory Outlets, Department Stores, Shopping Malls, Shopping ;Jakarta, Indonesia;11;-6.17511;106.865039
111;gita73;;50;2015/7/25;-6.905555,107.6199;Was spoilt for choices here,they had good selection of clothes mainly batik blouses,skirts,even kurti's,men's branded shirts...most of it was priced quite reasonably.you can get some decent bargains here,definitely worth a visit!!;292431917;plenty of choices...affordable and... - Summit Factory Outlet;30;Factory Outlets, Department Stores, Shopping Malls, Shopping ;KL;11;3.139003;101.686855
111;Hafidztan;;20;2016/12/14;-6.905555,107.6199;Nothing much to buy here. Stocks weren't attractive as it looks quite outdated. The only plus point would be that they do sell shirts of 3XL and above. So, if you're big size, you may just find something nice here.;444245039;Nothing much - Summit Factory Outlet;30;Factory Outlets, Department Stores, Shopping Malls, Shopping ;Singapore, Singapore;11;1.352083;103.819836
98;SmallWorldForAll;;40;2016/9/3;-6.90355,107.68017;Dear Trip Advisor,I submitted my review few days after I registered it for new listing in July.As this place has now been in the list, could you please post my review?I could re-write my review but I believe it is better to use the original one as it was closer to the date of my visit.Thanks a lot in advance for your kind help.Best regards,Ronald;414388286;Post original review please - Wisata Ilmu Sutera;40;;Jakarta, Indonesia;3;-6.17511;106.865039
96;random_musings;;40;2015/6/4;-6.906318,107.61941;The only FO that has a dedicated floor to men and women - so that you are not confused and you easily manage your shopping time. Right opposite Secret FO. Worth a stop on your FO expedition;277989375;Give it a go! - Jessie James Factory Outlet;35;Factory Outlets, Shopping ;Singapore, Singapore;7;1.352083;103.819836
99;flyawayAZ;;10;2016/4/27;-6.89016,107.60696;Although I knew the zoo did not have good ratings, others in my group wanted to go. I'm sorry I did. I visit zoos all over the world and this was the worst one I have seen in many years...maybe ever! Animals thin and in poor condition. In many cases, in extremely small cages with no natural materials. Old, rusty cages...but more important was the sadness of the animals in small, cement pens. Deer all had a skin condition that left bald patches all over their bodies. Pigs in a chest high muddy area with no way to get dry. A Sun Bear was in a small cement 'pit' with a metal grate...we stood directly above him and looked down as he stood on his hind legs, looking up at us and begging for food. We saw a number of large black rats in cages, quite bold in searching for food. Birds seemed to fair the best, but some were very overcrowded. The Night Herons had a nice enclosure with a pond, but so many birds, the water was stagnate and filthy. Entrance fee was low and peanuts could be bought to feed the animals, although I doubt that peanuts were acceptable for all the animals to eat. I saw a number of locals feeding the animals - crackers, cakes and candy and no official stopped them.Lots of shade between exhibits, so it was comfortable, but cannot recommend for all of the above reasons.;368325880;Not recommended - Bandung Zoo;25;Outdoor Activities, Nature & Parks, Zoos & Aquariums ;Scottsdale AZ;122;33.49417;-111.926052
99;Patrick H;;20;2016/5/1;-6.89016,107.60696;The condition of this zoo is very bad. Amimals don't receive enough treatment because they all look so thin and sad. There are many garbage, very dirty. The cages condition also not good. I hope the government will improve the condition of this zoo soon;369269566;Sad animals in this zoo - Bandung Zoo;25;Nature & Parks, Zoos & Aquariums, Outdoor Activities ;Bogor, Indonesia;122;-6.597147;106.806039
99;Sifis A;;10;2016/5/13;-6.89016,107.60696;A horrible place,hell on earth for all these poor animals.Rusty cages,dirty place and really neglected animals.Some of them are very thin,i believe they must be hungry.Not recommended for sure!;372668013;Shut down this place. - Bandung Zoo;25;Outdoor Activities, Zoos & Aquariums, Nature & Parks ;Bogor, Indonesia;122;-6.597147;106.806039
93;Jati H;;40;2016/3/16;-6.917433,107.60933;Place lil bit hidden, it's located on third floor in pasar cikapundung. And the antique stuff over here was quite good and the seller were very friendly. It's better to come on weekend and after 12pm too make sure the store are all open.;356235008;Good place to find good stuff! - Pasar Barang Antik Cikapundung;40;;Jakarta, Indonesia;4;-6.17511;106.865039
94;Linda C;;40;2015/7/12;-6.905275,107.61129;I come to this chapel often as this place has a unique Latin Traditional Catholic Mass. This traditional mass requires every woman who joined the program to wear veil or mantilla as the head cover.Served every second Sunday of every month (unless further notices), the activity always held at 16.00 (4 pm) the Latin Traditional mass brings a quite different of experience though the homilies will always be in Bahasa Indonesia.;288369049;Missa Latina at Bandung - Chapel Kabar Gembira maria;45;;Bandung, Indonesia;4;-6.917464;107.619123
95;SmallWorldForAll;;20;2016/7/24;-6.894736,107.65748;Don't expect too much as this small center provides only minimum exhibitions.The facilities, equipments and displays are poor and not well maintained.Staff are friendly but they need more training to convey the content in a more fun way for the children.;396462284;Need a lot of improvements - Bandung Science Center;35;Science Museums, Museums ;Jakarta, Indonesia;6;-6.17511;106.865039
95;fmuth;;50;2016/8/12;-6.894736,107.65748;It's a must visit site for children when come to Bandung. They can see many things about science here with a good guide. Dont worry if parents cant join the tour, their guides are so communicative to children. They explain science with child's language so kids understand. At the end of tour, they play interactive games. It was sooo fun!! And back home with new knowledges. Bravo BSC!! Keep improve...;404557634;Fun Learning @Bandung - Bandung Science Center;35;Science Museums, Museums ;tangerang;6;-6.202394;106.65271
92;yennimd;;50;2016/1/2;-6.957674,107.62281;Just found out about this place from my family, and we visited this water park today! It's absolutely lots of fun! They have several small slides great for little kids, and bigger slides great for kids to teenagers, and if adults want to try, still can try the biggest one! The price to enter this park is only Rp 50.000 per person. I can say that this is an amazing economical price for a water park! To rent a tube it's Rp 25.000 per 2 hours with Rp 25.000 deposit, and to rent a sliding board it's Rp 15.000 per 2 hours with Rp 15.000 deposit. We can also rent a gazebo on the side for only Rp 50.000,- for 2 hours, deposit only Rp 25.000,- I really feel that it's such an amazing deal. Also, it's such a fun park! Although today was extremely full of people, the park is quite well-maintained. It's still clean and very acceptable despite the flow of hundreds of people inside! My boys were having so much fun! We practically spent 4 hours in this park and they still wanted to stay longer. Oh, two small pools are filled with warm/hot water, the other pools are cold water, but it's good because this is located in hot area of Bandung. This location can be accessed from the Batununggal Permai Real Estate complex. I didn't take this route when coming in the morning, and instead took the small route behind the traditional market as I followed waze app's direction. :) Anyhow, I highly recommend this place for a family with small children to teenagers!;336617574;Economical price, great slides... - Panghegar Waterboom;35;Water Parks, Water & Amusement Parks ;Bandung, Indonesia;8;-6.917464;107.619123
93;Darnel-HDI;;40;2016/5/30;-6.917433,107.60933;This place is located near Jl Cikapundung and Jalan Braga. It is in the 3rd floor of Pasar Cikapundung. Here you can find antique stuffs or something look antique. It i s also interesting to visit for a window shopping.;377895465;Good Place for Antique Stuffs - Pasar Barang Antik Cikapundung;40;;Jakarta, Indonesia;4;-6.17511;106.865039
