poi_id;writer;keyword;wrating;wtime;mlocation;review;ids;titlen;mrating;mtipe;wlocation;mtotreview;wlocationlat;wlocationlong
40;Aurelia R;family tent, tea plantation, rabbit, boat, overrated, situ, nature;40;2017/7/16;-7.167077,107.354195;All I could say when we first arrived here was that the 6-hour trip from Jakarta was totally worth it. We were welcomed by the cool fresh air and we feasted on the beautiful view of the lake of Situ Patenggang and the tea plantations everywhere. The view was amazing. The tent itself was also far from disappointing. It was exactly like what people described. Clean for sure. We stayed in the family tent for 8 persons. It was quite spacious especially if you have small kids. The space in the middle of the tent is spacious enough for you and your family to sit together and do stuffs. However, I have to suggest that you bring a portable stove and rice cooker to cook your meal because the food in the phinisi restaurant quality was not too satisfying. We had lunch which had a so-so taste but the price was just like the restaurants at the mall in Jkt. The breakfast though, was not bad. You will get free breakfast for 8 as well, and thankfully, the breakfast was enjoyable.If you are Indonesians, be prepared to get very cold during the night and in the morning. Get your jacket and sweater ready. Especially, if you visit here during summer (June-August). The temperature can hit as low as 10'C. But dont worry, they do have water heater which makes taking shower a no problem at all.Lastly, I would recommend this place if you want to stay away from the standard stay in the hotel kind of holiday. Glamping is DEFINITELY the right choice. Your children will have so much fun. They get to appreciate the nature and oh, this place has rabbit farm and some other attractions as well. So they won't waste their time doing nothing in the tent. There are lots of stuffs to do here. ;502416591;Camping at its best - Glamping Lakeside Ciwidey;45;Points of Interest & Landmarks, Sights & Landmarks ;Singapore, Singapore;25;1.352083;103.819836
40;Yunus M;family tent, tea plantation, rabbit, boat, overrated, situ, nature;50;2017/10/9;-7.167077,107.354195;If you look this up, you'll see that this ship themed restaurant has some stunning views. We arrived towards evening and the fog was rolling in, still made for an eerie but beautiful setting and the food was good (buffet or a la carte) at mid range prices. Perhaps a bit pricey to get to and to eat at on a backpacker budget but we were lucky enough to have a local drive us.If you get the chance, take it. ;530428044;Beautiful - Glamping Lakeside Ciwidey;45;Points of Interest & Landmarks, Sights & Landmarks ;Leicester, United Kingdom;25;52.636878;-1.139759
41;SiskaPurnama;;40;2017/4/10;-6.913453,107.609;Artistic place, a good ambience where citizen can relate each others in one place. Many photograph angles!;474383995;Very Modern City Hall - Balai Kota Bandung;40;Government Buildings, Nature & Parks, Sights & Landmarks ;Bandung, Indonesia;31;-6.917464;107.619123
40;BillNabilah;family tent, tea plantation, rabbit, boat, overrated, situ, nature;40;2017/7/28;-6.911733,107.61102;Good for sightseeing, although it's actually quite overrated. Best place for taking pics, as it is in the middle of tea plantation. Suitable for family.;506606789;Beautiful lake view - Glamping Lakeside Ciwidey;45;Points of Interest & Landmarks, Sights & Landmarks ;Sepang, Malaysia;25;2.691369;101.750527
40;Nindya Nastiti P;family tent, tea plantation, rabbit, boat, overrated, situ, nature;40;2017/9/3;-6.911733,107.61102;Located approximately 24 miles from Bandung, this place is a really breath-taking. If you want to catch a great view without annoy by a lot of people take a selfie with that famous selfie stick, you better get off on early morning.The weather is still fresh and the scenery was full of greeny and you could see the legendary Situ Patengan from above. They also provide some food for breakfast, but it just so-so.;520930816;Nice Weather, Nice Scenery! - Glamping Lakeside Ciwidey;45;Points of Interest & Landmarks, Sights & Landmarks ;Sepang, Malaysia;25;2.691369;101.750527
41;moemoerizal;;30;2017/4/9;-6.913453,107.609;For all of you who look for affordable city park visit, The City Hall can be a good options. It has been renewed and renovated for many times. And the maintenance seems running quite well. The local government put so much effort into designing the new look of The City Hall. There were flowers, statues, water fountain, and even ponds.My tip: Do not go here on Sunday. Too many people. Too crowded. Though there would be more food vendors, but I personally don't like the idea of bunches of teenagers practicing their cover dance all around the hall. At some point, they blocked the beauty of the park itself.;473983211;Cheap and Worth It - Balai Kota Bandung;40;Government Buildings, Sights & Landmarks, Nature & Parks ;Bandung, Indonesia;31;-6.917464;107.619123
41;Jeffry T;;40;2017/5/8;-6.913453,107.609;For those of you who happen to drop in or vacation in the city of Bandung, you can enjoy a shady city park with fresh air to remove your fatigue by the view of green plants and colorful flowers.;482772444;A nice place to hangout with friends... - Balai Kota Bandung;40;Government Buildings, Nature & Parks, Sights & Landmarks ;Bandung, Indonesia;31;-6.917464;107.619123
41;LenAdriani02;;50;2017/6/15;-6.911733,107.61102;I went here with the other Moms from my neighbourhood because it was one of a famous place to go since Ridwan Kamil became the mayor of Bandung. It was clean and lots of photo spots. The public toilet is very clean unlike several years ago. There has been a lot of good progress ever since Ridwan Kamil became the mayor.;493431698;A cheap and fun place to hangout - Balai Kota Bandung;40;Government Buildings, Sights & Landmarks, Nature & Parks ;Bandung, Indonesia;31;-6.917464;107.619123
41;Andi_Ilham;;30;2017/8/24;-6.913453,107.609;If you like do jogging or walking exercise during vacation/trip in Bandung, you can choose this track for jogging, or citywalk from Bandung City Hall to Braga, or even to Alun Alun Square, in the morning or in the afternoon. There is pedestrian walk/path all along the way.;517265863;Good track for Jogging, or Citywalk... - Balai Kota Bandung;40;Government Buildings, Nature & Parks, Sights & Landmarks ;Bandung, Indonesia;31;-6.917464;107.619123
42;chandra s;;40;2015/7/22;-6.911733,107.61102;nice view and weather, it is a nice place to have fun and get away from city bustling life for a change. Traffic going there is quite tight though...;291616200;good place to take a deep breath - Malabar Tea Plantations;40;Nature & Wildlife Areas, Nature & Parks ;Jakarta, Indonesia;46;-6.17511;106.865039
41;SoapAddict;;50;2017/6/17;-6.911733,107.61102;There are a lot of things to do here since the mayor give gradual renovation here and there, there is a labyrinth theme park, swimming pool that is accesible for public for free (only there is no wash area), there are a lot of instagramable spot around the area. Worth to visit, even for locals!;493883652;A good way to spend your weekend... - Balai Kota Bandung;40;Government Buildings, Sights & Landmarks, Nature & Parks ;Bandung, Indonesia;31;-6.917464;107.619123
41;Yanssens T;;30;2017/10/9;-6.911733,107.61102;Thanks to Kang Emil, the major of Bandung, now Balaikota Bandung is one of Bandung's icon. They have pond and lots of trees. You can sit and play water from the pond. But, nowadays there are so many food seller and it make the view not nice. Also people litter everywhere and make the place dirty. ;529410674;Nice place to visit but.. - Balai Kota Bandung;40;Government Buildings, Sights & Landmarks, Nature & Parks ;Bandung;31;-6.917464;107.619123
42;EricLia;;50;2015/9/11;-6.911733,107.61102;Very nice view from the top and cool weather, especially while sipping a cup tea or better still, a cup of luwak coffee.;309245632;Nice view while sipping..... - Malabar Tea Plantations;40;Nature & Wildlife Areas, Nature & Parks ;Alor Setar;46;6.1248;100.367818
41;Tjoen;;30;2017/10/9;-6.913453,107.609;Located close to the Cathedral church and Taman Vanda, the Balai Kota is one of the interesting places to visit, where there are still large trees that are shady enough to enjoy the atmosphere during the day without having to be exposed to sunlight.On the north side there is a simple pool arena for children and there is a Historical Park.;529274721;One of the city parks is quite... - Balai Kota Bandung;40;Government Buildings, Nature & Parks, Sights & Landmarks ;Bandung;31;-6.917464;107.619123
42;manuele;;50;2015/9/15;-6.911733,107.61102;A wonderful and scenic place to stay for a few days, far away from the crowds, fresh air, all the place is about 1200 m high. We stayed with our two girls in an old tea plantations, an original dutch leftover, named 'Malabar Mess', a long ride from the chaotic City of Bandung, and we all loved that place, especially the walks in that green tea terraces...You will need a driver to go there.. On the spot you can rent a motorbike to go to the nearby town where there are plenty of small 'Warungs' and nice market...;310533523;Amazing and away from it all - Malabar Tea Plantations;40;Nature & Wildlife Areas, Nature & Parks ;Witten/Ruhr;46;51.443893;7.353197
42;wingnut08;;40;2015/8/12;-7.167077,107.354195;We set out from Bandung, Java, Indonesia to see the extinct volcano known as Kawah Putih and Malabar Tea Plantations.To be honest we had hired a local car and driver for the day and that took a lot of strain out of the trip.We started out on 18th July 2015 (probably a bad day as it was the Muslim new year and everyone seemed to be on holidays) AVOID that time of year if possible.We set out early in the morning for what was supposed to be a reasonable drive about 60 Km to the volcano I don't think the car got out of 2nd and 3rd gear the whole trip there were thousands upon thousands of motorcycles all doing the same trip (and the same going the opposite direction) it was impossible to get any speed up however after about 3 hours we arrived at the 'volcano' a weird site its about 2300 metres above sea level which kept the temperature bearable. You have to walk a short distance from the car park to the volcano basin and on to the crust -- be aware there are many people about all wanting to sell you surgical masks (they are cheap) so if your going there bring your own as there is a smell of sulphur. The crust is a white covering of some kind of water dust and mud (watch out for your shoes) you would get the impression you were in a huge skating rink but most people seemed like they wanted to walk about on the crust a warning tells you that you should only spend 15 minutes in the basin area.After we had done Kawah Putih we set off for Malabar Tea Plantations its about 20 minutes drive away at crawl speed, On arrival in the area they are a beautiful sight to see loads of hills all covered in tea trees all cut into patterns to allow the workers to collect the tea leaves at the top of the trees (the best tea leaves) we were told. We never went to the actual Tea Resort as it was a distance away and we had to start our return journey back to Bandung. The traffic was just as heavy on the way back so if your thinking of going to see both these 'sights' check first that its not a holiday. Having a local driver and car certainly took a lot of strain out of the trip you can sit back and admire the country side from low level fields full of rice up the Jungle trees and beautiful sights looking down into valleys below talk to other companions and just enjoy the trip even if its only at 10 to 15Km an hour. If your going make it a full day trip there are a few sights on the way worth stopping at;298348687;Malabar Tea Plantations - Malabar Tea Plantations;40;Nature & Wildlife Areas, Nature & Parks ;Armagh County;46;54.350066;-6.652312
42;Muller-reizen-op-pad;;30;2015/9/18;-7.167077,107.354195;A tour in the factory (10-15 minutes, cup of tea, a teapack) about the teaprocess is nice but expensive (80.000Rp) for what you get. The walk in the field you can do for free and nice to make pictures.;311639157;If you love tea it is interesting - Malabar Tea Plantations;40;Nature & Wildlife Areas, Nature & Parks ;The Netherlands;46;52.132633;5.291266
42;Seetalusha;;50;2015/12/12;-6.913453,107.609;Besides shopping this was another refreshing place .the greenery was eye relaxing . It was fun seeing how quickly the girls used both their hands to pick the top leaves from the tea plants .;332304027;Malabar tea plantation - Malabar Tea Plantations;40;Nature & Wildlife Areas, Nature & Parks ;Singapore, Singapore;46;1.352083;103.819836
42;Taco d;;40;2016/5/29;-6.911733,107.61102;Went to see the Malabar estate and factory. The estate is beautiful, I had lunch in the manager bungalow, good food!! The bungalow had its old beauty still, than took a long walk through the gardens to the hilltop where there is a small canopy and where you have a great view of the surrounding areas. Walked back through the village to see the folks working on the estate. The estate and the factory are now under government management and this was most apparent in the factory that was in a dilapidated condition. Also the quality of the tea produced clearly showed poor plucking techniques and poor supervision by management. The buildings and machinery were poorly maintained, this was a bit of a disappointment.;377617570;Beautiful gardens - Malabar Tea Plantations;40;Nature & Wildlife Areas, Nature & Parks ;Sanur, Indonesia;46;-8.707178;115.262624
42;Afif H;;40;2016/3/25;-6.911733,107.61102;A refreshment site, beautiful scenery, yet a bit far from bandung. You can see the boscha tomb, the founder of this plantation and his house. You can rent the inn inside the plantation, or you can camp around the tea..its your choice.;358571346;Perfect for camp - Malabar Tea Plantations;40;Nature & Wildlife Areas, Nature & Parks ;Singapore, Singapore;46;1.352083;103.819836
44;filou1212;open to the public, unique building, education, architecture, dutch, indonesia;50;2016/4/7;-6.911733,107.61102;This building is in the grounds of the Education University and a short walk from the Mercure Setiabudi and several other hotels. It is well worth a look, especially for fans of this style of architecture. You cannot go inside but you can view the building from all angles, take some great photos, and the surrounding gardens are also lovely.;362418921;beautiful art-deco building - Villa Isola;40;Architectural Buildings, Sights & Landmarks ;Melbourne, Australia;67;-37.813628;144.963058
44;Apsha;open to the public, unique building, education, architecture, dutch, indonesia;50;2016/1/29;-6.911733,107.61102;One word, unique! I grew up at this place. My elementary school is on the same complex. Almost everyday I visited this place. Someday, I try to enter this building for study tour. It has a circle stairs everywhere. Amazing! So every room in this building look like a secret room because the door positions are somehow unexpected. My favourite, is at the left wings (outside). Because there is a circle stairs, so we can slide into the ground. What a childhood memories :);343695603;Isola, Bumi Siliwangi - Villa Isola;40;Architectural Buildings, Sights & Landmarks ;Bandung, Indonesia;67;-6.917464;107.619123
42;Darnel-HDI;;40;2015/11/18;-7.167077,107.354195;This tea plantation is located at the elevation of 1200 meters in the foot of Malabar Mount. It is about 50 kilometer south of Bandung. One of the oldest tea plantation established during Dutch occupation. The view is very beautiful and the air is very fresh. You can have the tea processing tour or walk atound on your own.;327710208;Nice View and Nice Weather - Malabar Tea Plantations;40;Nature & Wildlife Areas, Nature & Parks ;Jakarta, Indonesia;46;-6.17511;106.865039
42;Ling L;;40;2016/6/8;-6.913453,107.609;This place is located around 2.5 hrs from centre of Bandung.Can be reached by public transport but my suggestion is more convinience to go by own car.Passing this palace u can visit the famous of White Crater and Patenggang Lake.Nice green and beautifull scenery.Very recommended !!!;380995506;Amazing Tea Plantation View ! - Malabar Tea Plantations;40;Nature & Wildlife Areas, Nature & Parks ;Bandung, Indonesia;46;-6.917464;107.619123
44;bob s;open to the public, unique building, education, architecture, dutch, indonesia;10;2016/5/13;-6.911733,107.61102;So it's a garden and campus tour. Not a big garden either. I wouldn't recommend going out of your way for this! If you are close by, then go for it. ;372690263;Can't go in - Villa Isola;40;Architectural Buildings, Sights & Landmarks ;Melbourne, Australia;67;-37.813628;144.963058
44;IraRahmayanti;open to the public, unique building, education, architecture, dutch, indonesia;30;2016/2/18;-6.911733,107.61102;It was built as a villa, but now functioning as the office of Rector/President of Indonesia University of Education/UPI. Some official ceremony still held there (like doctoral seminars and the like). Some people even do pre wedding session here (outside of course..). Its a beautiful building, a good object for picture but cant go inside.. ;349016771;Good for picture, cant go inside.. - Villa Isola;40;Architectural Buildings, Sights & Landmarks ;Bandung, Indonesia;67;-6.917464;107.619123
44;Indra P;open to the public, unique building, education, architecture, dutch, indonesia;30;2016/3/16;-6.861283,107.59296;Designed by Dutch architect Charles Prosper Wolff Schoemaker as main resident of businessman Willem Beretty. Schoemaker take art deco seriously in building Isola. Combining cruise boat-like design and classic Renaissance-era garden.Isola now functioned as rectorate building for Universitas Pendidikan Indonesia (Indonesian Education University).;356203338;Best Art Deco Building In Bandung - Villa Isola;40;Architectural Buildings, Sights & Landmarks ;Jakarta;67;-6.17511;106.865039
61;Yeni H;;30;2017/7/12;-6.911733,107.61102;well at least no need to walking side by side with cars, but too crowded, and no rain shelter. it's good place to enjoy culinary.;501181162;nice concept - Teras Cihampelas;35;Points of Interest & Landmarks, Bridges, Scenic Walking Areas, Sights & Landmarks ;Jakarta, Indonesia;29;-6.17511;106.865039
44;Astie R;open to the public, unique building, education, architecture, dutch, indonesia;50;2016/9/9;-6.911733,107.61102;this is my university attractive point. the building has been a university office, but it has a long way history about it.;416647686;University Main Point - Villa Isola;40;Architectural Buildings, Sights & Landmarks ;Melbourne, Australia;67;-37.813628;144.963058
61;Leo H;;40;2017/8/22;-6.89593,107.60396;Very crowded at weekend many food in there. Teras cihampelas is a walking zone at upside cihampelas street.;516217590;Crowded - Teras Cihampelas;35;Points of Interest & Landmarks, Bridges, Scenic Walking Areas, Sights & Landmarks ;Jakarta, Indonesia;29;-6.17511;106.865039
44;NikolasEdo11;open to the public, unique building, education, architecture, dutch, indonesia;40;2017/3/22;-6.911733,107.61102;This building is good for photoshoot for instagram or relaxing because the architecture is made by Dutch in the Colonial era in the past.;469381724;Historical Building of Indonesia - Villa Isola;40;Architectural Buildings, Sights & Landmarks ;Bandung, Indonesia;67;-6.917464;107.619123
44;Berry C;open to the public, unique building, education, architecture, dutch, indonesia;50;2016/8/28;-6.911733,107.61102;a unique building. people said this building is one of the best of art deco building in the world. unfortunately is not open to the public, but we can still enjoy this building from the outside, while sitting in his garden spoiled cool.;412072460;a great architectural building - Villa Isola;40;Architectural Buildings, Sights & Landmarks ;Melbourne, Australia;67;-37.813628;144.963058
61;nuningloft;;20;2017/10/9;-6.89593,107.60396;We're come arround 7.00 pm. And try to explore this open area. And then we're smell some bad air. Looks like a lot of people already peeing often in some area. Many shops sell same item. And no special price. ;529446223;Bad smell - Teras Cihampelas;35;Points of Interest & Landmarks, Bridges, Scenic Walking Areas, Sights & Landmarks ;Karawang, Indonesia;29;-6.301566;107.296652
67;uthinx;;50;2014/9/24;-6.911733,107.61102;Even this building already became Bank Tabungan Pensiunan Nasional, you still can visit this Building and if they have time, they are willing to accompany you and tell the story about this building.Built in 1937 and had a lot renovation from several owners, but 3 years ago BTPN started the restoration the building back to 1937..;230797711;The gem of Bandung - Gedung De Driekleur / Gedung Tiga Warna;40;Architectural Buildings, Sights & Landmarks ;Indonesia;21;-0.789275;113.921327
67;kenshin8088;;40;2015/3/18;-6.911733,107.61102;Since the restaurant is close to the main road we were disturbed by the cars. The wall of plants also had a plastic wall which wouln't let any wind or air pass and therfore made it very hot inside.;260336138;so far so good - Gedung De Driekleur / Gedung Tiga Warna;40;Architectural Buildings, Sights & Landmarks ;Bandung, Indonesia;21;-6.917464;107.619123
67;Hans K;;40;2015/4/20;-6.911733,107.61102;Build with art deco style this building also a history monument for Indonesia Independence.The Declaration of Indonesian Independence was sounded around the world from this building on 18 August 1945. A Japanese News Radio 'Gomei' stream the news from this building.The Drekleur, or 3 Colour was built in 1937 by Alburst.the building now is used by Bank Tabungan Pensiunan Nasional (BTPN) as their Main Branch in Bandung, on February 2014, BTPN finished restoration the building.;266942757;a history monument for Indonesia... - Gedung De Driekleur / Gedung Tiga Warna;40;Architectural Buildings, Sights & Landmarks ;Bandung, Indonesia;21;-6.917464;107.619123
67;Hardy Y;;30;2015/6/3;-6.911733,107.61102;the building is occupied as local bank office and keep the building in the same perform as it was built;277726688;keep the same viewed - Gedung De Driekleur / Gedung Tiga Warna;40;Architectural Buildings, Sights & Landmarks ;Bandung, Indonesia;21;-6.917464;107.619123
67;Tedjo Boogie T;;40;2015/7/14;-6.905643,107.61075;surely after alost a year, and personally abit involve in having de driekleur launch, i can say that am still in love with fall more in love with de driekleur. being save by aheroic action of BTPN, preserving and gettiing it shaped as once its stand high and proud in bandung, i may say, a very huge efforts and a ver rewarding to be able proudly say that bandung succeded to keep the landmark a favor off alltime. thank you BTPN and you guys need to experience the life that created bandung becoming the java's paris in time. ;289001087;a bandung heritage maintain - Gedung De Driekleur / Gedung Tiga Warna;40;Architectural Buildings, Sights & Landmarks ;Jakarta, Indonesia;21;-6.17511;106.865039
67;EmergingMarketSkptc;;40;2014/9/12;-6.905643,107.61075;From the pictures posted here, this is a building that I walked by on my way to the Gedung Sate in October 2013 when it was being restored and remodeled into what I suppose would be a bank branch or bank offices. I hope they did a good job of trying to preserve as much of the art deco work as possible as clearly the building is an architectural gem worth preserving. The area around it also has other colonial style houses in various states of decay or preservation. If I recall correctly, this was originally a house built by a Dutch colonial doctor.;228563248;Was being restored when I walked past it - Gedung De Driekleur / Gedung Tiga Warna;40;Architectural Buildings, Sights & Landmarks ;Kuala Lumpur, Malaysia;21;3.139003;101.686855
67;IraRahmayanti;;30;2016/2/18;-6.911733,107.61102;Its a bank now, thats why you cant go inside, except you have something to do with them. its one of heritage of the glorious era of Bandung in early 19 century..;349016132;You can only see, cant go inside.. - Gedung De Driekleur / Gedung Tiga Warna;40;Architectural Buildings, Sights & Landmarks ;Bandung, Indonesia;21;-6.917464;107.619123
67;Indra P;;30;2016/3/16;-6.911733,107.61102;De Driekleur (Three Color), was designed by art-deco turn modernist Dutch architect, A.F. Aalbers. Aalbers was a prominent architect in Bandung, beside C.P Wolff Schoemaker. Jl. Ir.H. Juanda (Dago), is an Aalbers' living museum. There are several Aalbers' works such as Gedung Pemuda Pancasila, three villas neas Borromeus Hospital known as 'Drie Locomotief', and 12 Llyod Wright-styled villas in Jl. Pagergunung.De Driekleur now functioned as Bank Tabungan Pensiun Negara (BTPN) office for Dago branch.;356204387;Well Preserved Streamline Art Deco... - Gedung De Driekleur / Gedung Tiga Warna;40;Architectural Buildings, Sights & Landmarks ;Jakarta;21;-6.17511;106.865039
67;Titin W;;40;2015/11/14;-6.911733,107.61102;Old building with important historical event. Interesting with still 'creepy' feel, wonder what was it like back then;326786716;Interesting building - Gedung De Driekleur / Gedung Tiga Warna;40;Architectural Buildings, Sights & Landmarks ;Jakarta, Indonesia;21;-6.17511;106.865039
67;Patrick C;;30;2017/7/23;-6.905643,107.61075;The Driekleur building is a gorgeous design by one of colonial Indonesia's most important architects, but today it is difficult to view from the exterior (we just drove by). The interior has been completely redone for use as a bank, so no use going in. At least the facade has been retained and the building is being looked after -- unlike so many lovely historic buildings in Bandung.;504774095;A beautiful building in a difficult... - Gedung De Driekleur / Gedung Tiga Warna;40;Architectural Buildings, Sights & Landmarks ;Novato, California;21;38.10742;-122.569703
