poi_id;writer;keyword;wrating;wtime;mlocation;review;ids;titlen;mrating;mtipe;wlocation;mtotreview;wlocationlat;wlocationlong
9;Arizaldi A;sate, west java, government office, bandung city, iconic building, public building, pullman hotel, photo op, green garden, nice building, beautiful architecture, dutch architect, take pictures, pre wedding, visit this place, visit bandung, governor;40;2017/4/17;-6.901336,107.61877;Great for photo taking. Gasibu field in front of it. Local food and snack seller around. Avoid come in the crowded weekend and rush hour weekday.;476646782;Nice place to visit - Gedung Sate;40;Architectural Buildings, Sights & Landmarks ;Jakarta, Indonesia;430;-6.17511;106.865039
1;donna_tobing;braga permai, old buildings, night life, art galleries, nice walk, dutch colonial era, cup of coffee, young people, saturday night, bandung city, heritage building, walk around, nice place, alun alun, take pictures, paris van java, visit bandung;40;2017/9/6;-6.917027,107.60911;The Braga's street serve everyone with a clean environment, nice situation, many kind of restaurant which are fulfill with cozy sorrounding and of should taste delicious ice cream by sitting on the chair... So relaxing....;521892366;Walking down the Braga's street, taste... - Braga Street;40;Neighborhoods, Other, Sights & Landmarks ;Bandung, Indonesia;1509;-6.917464;107.619123
9;sanghaya;sate, west java, government office, bandung city, iconic building, public building, pullman hotel, photo op, green garden, nice building, beautiful architecture, dutch architect, take pictures, pre wedding, visit this place, visit bandung, governor;30;2017/6/15;-6.901336,107.61877;People say that you really haven't been to Bandung if you do not have a picture of yourself with the Gedung Sate as background. This piqued my curiosity so we checked it out. It was an after-the-rain affair so things are kind of soaked up.Nothing really to see as you are not allowed to go in. Simply bask on the sight of it outside its fence. Though, it was really nerve wracking trying to cross the street as vehicles moved so fast (and sometimes not really minding the pedestrians). ;493394883;Average though people say it's a... - Gedung Sate;40;Architectural Buildings, Sights & Landmarks ;Philippines;430;12.879721;121.774017
9;Momtravelwithtoddler;sate, west java, government office, bandung city, iconic building, public building, pullman hotel, photo op, green garden, nice building, beautiful architecture, dutch architect, take pictures, pre wedding, visit this place, visit bandung, governor;30;2017/6/24;-6.901336,107.61877;Was here on Hari Eid. Public holiday , hence closed. Nothing much to see. Building got its name from the top of the building that looks like a sate stick sticking out. ;495766304;Just a government office in a heritage... - Gedung Sate;40;Architectural Buildings, Sights & Landmarks ;Philippines;430;12.879721;121.774017
11;fatimadinaa;world war, flash light, proper shoes, small waterfall, trail run, walk approx, admission price is, local guide, rainy season, motor taxi, km hike, water fall, beautiful nature, big trees, sport shoes, instant noodle, the main attraction;40;2017/5/19;-6.857436,107.63119;I loved to run or walk on Sunday morning for a refreshment after a week of working. And this place is a really good place to refresh your mind. Offers you clean air and beautiful view. You can also visit the 'Penangkaran Rusa' to see the cute deer and feed them. You need to walk approx. 4 km, but totally worth it. You can use 'ojeg' as well if you're too tired to walk.;485548460;Peaceful Place - Forest Park Conservation Area Tahura Ir. H. Juanda;40;Nature & Wildlife Areas, Nature & Parks ;Maumere, Indonesia;303;-8.624551;122.214696
14;Alvean M;hot water, tangkuban perahu, private rooms, warm temperature, spring water, foot massage, pay additional, fish spa, visited this place, nice view, fresh air, nice place, dip, soaking, midnite, skin, subang;30;2017/7/3;-6.738654,107.6536;Constant flow from natural hot spring great soaking for the family to rejuvenate and enjoy nature. can be quite slippery and steep to get to the actual hotel spring area, so be careful.;498411475;Therapeutic soak for great skin - Sari Ater Hot Spring;35;Hot Springs & Geysers, Nature & Parks ;Singapore, Singapore;492;1.352083;103.819836
14;CasChen;hot water, tangkuban perahu, private rooms, warm temperature, spring water, foot massage, pay additional, fish spa, visited this place, nice view, fresh air, nice place, dip, soaking, midnite, skin, subang;30;2017/6/10;-6.738654,107.6536;Went there with family. Good place to visit for hot spring. You can select the level of hot spring depending on your requirement;492086857;Hot spring - Sari Ater Hot Spring;35;Hot Springs & Geysers, Nature & Parks ;Singapore, Singapore;492;1.352083;103.819836
5;Mike M;food court, fish ponds, one stop shopping, branded clothes, nice place to shop, shop till you drop, wide range, coffee shop, reasonable price, shopping heaven, t shirt, shopping place, many choices, parking space, food stalls, visit this place, visit bandung;40;2017/9/25;-6.882722,107.59944;Very reasonable prices for a number of fashion lines. Mens range is not as diverse as womens but still some good bargains to be had. Some nice cafe style eating places and Java Bean coffee shop.;525632615;Good value - Rumah Mode Factory Outlet;40;Factory Outlets, Shopping ;Malaysia;973;4.210484;101.975766
12;waver20;beautiful lake, tea plantation, love rock, pedal boat, high altitude, nice pictures, fresh air, from afar, green view, body and soul, extra money, nice place to visit, cool weather, local food, strawberry farm, public transportation, west java;40;2017/5/3;-7.12257,107.42426;Get bored in routines there is such a way to eliminate them. Let's enjoy the beauty lake surrounding tea plantation. At the mountain region very high altitude in the southern of Bandung you would feel deep cold sensation and you need a sweater when you get there. Clean and calm lake surrounding by mountain and a lot of traditional boat w/without would bring you around the lake. Good for family and coyples You will not be dissappointed, don't miss it.;481484838;Nice again travelling to beauty lake - Patenggang Lake;35;Other Nature & Parks, Bodies of Water, Mountains, Nature & Parks ;Pekanbaru;379;0.507068;101.447779
7;ariyanti d;shopping mall, ice skating, international brands, nice mall, mango, burger king, nice concept, parking space, department store, f b, the ground floor, cafes and restaurants, branded stuff, traffic jam, nice place, many choices, coffee shop;30;2017/9/25;-6.889453,107.59608;Drop off area nyaa gak enak untuk menunggu jemputan, sempit. Please provide some decent seats for visitors.;526164828;Just another mall - Paris Van Java;40;Shopping Malls, Shopping ;Bandung, Jawa Barat, Indonesia;894;-6.917464;107.619123
10;Frederik1958;great leaders, world history, historic event, founding fathers, asia africa, great moment, historical site, indonesian history, classic building, old building, go somewhere else, alun alun, visit this place, bandung city, braga street, soekarno, movement;50;2017/2/22;-6.921286,107.60898;The Asia Africa museum shows the first conference of independent states in 1955 initiated by President Sukarno.;461973319;A must for those who are interested in... - Museum of The Asian-African Conference;40;Specialty Museums, Museums ;Hank, The Netherlands;353;51.734558;4.895935
3;CheiThai M;indoor theme park, roller coaster, giant swing, dunia lain, science centre, vip pass, cash card, ghost house, adrenaline rush, ticket price, food court, entrance fee, shopping mall, nice place, rides, yamaha, parade;40;2017/9/18;-6.925377,107.63617;Great place to spend a day with. Varieties of shows available. But they mostly speaks in bahasa indonesia which is hard to understand. The roller coaster was under maintenance. ;524824381;Great for one day trip. - Trans Studio Bandung;40;Theme Parks, Water & Amusement Parks ;Malaysia;1772;4.210484;101.975766
3;M_Suryadi;indoor theme park, roller coaster, giant swing, dunia lain, science centre, vip pass, cash card, ghost house, adrenaline rush, ticket price, food court, entrance fee, shopping mall, nice place, rides, yamaha, parade;30;2017/9/25;-6.925377,107.63617;You can enjoy any attraction here without worries about hot of sun and wet of raining... Yes biggest indoor place with variance model of attraction especially for kids and teenagers, they will really like it alot and forget time to go home hehehe...;526871057;Attraction world without worries about... - Trans Studio Bandung;40;Theme Parks, Water & Amusement Parks ;Jakarta, Indonesia;1772;-6.17511;106.865039
6;Sid5515;sensa hotel, pizza hut, game center, jeans street, shopping mall, fast food, lunch dinner, outdoor shopping, game master, night walk, shops selling, food selection, fashion stores, shoe store, open space, suitable place, pine trees;40;2017/7/8;-6.894128,107.60515;Other than individual outlets around the city, do take a look at this mall. Other than its clothing retails, there are many food outlets here. The musolla (praying hall) is also convenient and quite unique. You can left your belongings at the counter and will be given one card to collect back your item later. Another interesting about this mall is its park which is well situated to balance the shopping atmosphere.;499648402;Mall with nice walkway and parks - Cihampelas Walk;40;Shopping Malls, Shopping ;Bangi, Malaysia;337;2.902075;101.783005
30;Eno P;white colour, historical building, take pictures, jalan braga, vanda, dutch, indonesia, traffic;50;2016/1/12;-6.914727,107.60909;building a good, sturdy, and pleasing to the eye, located close to the town hall Bandung, easily accessible by public transport;339368937;Nice building - Bank Indonesia Building;40;Architectural Buildings, Sights & Landmarks ;Bandung, Indonesia;123;-6.917464;107.619123
2;Fida L;t rex, earthquake simulator, english translations, school children, gedung sate, bahasa indonesia, on display, the ground floor, interesting place, entrance ticket, ticket price, souvenir shop, must visit place, old building, dinosaur, replica, information;50;2017/9/5;-6.900554,107.62045;Came here with my husband and the museum was beyond expectation. It was well maintained and so many interesting knowledge. I just came to know that Indonesia has very beautiful geological treasure. ;521542290;Cheap and interesting - Geology Museum;40;Science Museums, Museums ;Shah Alam Selangor;628;3.073281;101.518461
2;CakNarto;t rex, earthquake simulator, english translations, school children, gedung sate, bahasa indonesia, on display, the ground floor, interesting place, entrance ticket, ticket price, souvenir shop, must visit place, old building, dinosaur, replica, information;30;2017/8/27;-6.900554,107.62045;Basically this museum is good especially for my 4yo son to learn about geology (he loves nature), but the place is not attractive since smelly, not bright and cannot attract kids (kids love ice cream and some snacks).This museum too old within Bandung that famous as young and dynamic city.I wish, great museum like that can be concerned more by government.;518176662;Penuh pengetahuan tapi kurang atraktif - Geology Museum;40;Science Museums, Museums ;Shah Alam Selangor;628;3.073281;101.518461
30;Veve9588;white colour, historical building, take pictures, jalan braga, vanda, dutch, indonesia, traffic;50;2015/12/24;-6.914727,107.60909;Going with friend, just come for short time and have good experience with this old builing with long history. This colonial style building is a good place for take some photos;334805129;Quite good - Bank Indonesia Building;40;Architectural Buildings, Sights & Landmarks ;Jakarta, Indonesia;123;-6.17511;106.865039
30;Phi S;white colour, historical building, take pictures, jalan braga, vanda, dutch, indonesia, traffic;30;2016/2/9;-6.914727,107.60909;A very interesting and colonial building but nothing special. Nice pice to take some photos.There is a park in front of the building, which was opened about a year ago. The park is very clean and pleasant place for a stroll.;346175942;Colonial building - Bank Indonesia Building;40;Architectural Buildings, Sights & Landmarks ;Bangkok, Thailand;123;13.756331;100.501765
30;gedebudis;white colour, historical building, take pictures, jalan braga, vanda, dutch, indonesia, traffic;30;2016/1/13;-6.914727,107.60909;I am not sure whether the building can be opened to public everyday. The building itself is an old one used as a branch of national bank. I suspect that the building is close on holidays and weekends, but the park in front is also attractive to visitors as provided plenty space for doing activity. Family can gather and take a group photo in the park with the building on the background.;339805992;The building itself is a heritage, but... - Bank Indonesia Building;40;Architectural Buildings, Sights & Landmarks ;Bandung, Indonesia;123;-6.917464;107.619123
60;clemencia r;;30;2015/10/22;-6.937617,107.60347;Sri Baduga museum entrane is o ly 3000 rupians. Is is a small obe so you may be finish its visit in one hour. People is vrey nice and try to help you. there is free wifi ;320849028;Small but nice museum - Museum Sri Baduga;35;Specialty Museums, Museums ;Shah Alam, Malaysia;32;3.073281;101.518461
60;pianocello;;20;2014/3/31;-6.937617,107.60347;As is the case with Indonesian provincial museums, the quality of this is poor. There are no attempt to make the exhibits interesting. Considering the historical and cultural heritage of Western Java, many of the exhibits look like they could have been purchased at local shops. It's a shame because even the Central Java museum in Semarang was much better in quality.As this museum is a bit out of the tourist areas, there is no need to go all out to see this unless you have run out of things to see (the admission fee is cheap though).;199479110;Only if you are running out of things... - Museum Sri Baduga;35;Specialty Museums, Museums ;Shah Alam, Malaysia;32;3.073281;101.518461
58;tonyc496;;20;2013/6/6;-6.915829,107.62752;This place offers you nothing but outdated sundial. It's located quite far outside Bandung. Not worth visiting.;163147091;Nothing special at all - Sundial;35;Monuments & Statues, Sights & Landmarks ;Singapore, Singapore;31;1.352083;103.819836
59;Patrick_Leez;cheap price, factory outlet, outlets, display, men, clothing, quality, shirts, indonesia, shopping;50;2016/3/9;-6.882095,107.59956;In my first trip to Bandung, I visited this outlet and found it amazing!Fashion World Indonesia offer high quality fashion with good price..It has some area that under construction, when I took a peek, it seems that there will be large food area with nice theme...Very exited when I saw that!Can' wait to visit here again, especially for the upcoming new area!;354226346;Nice Shopping Place - Fashion World Indonesia;45;Factory Outlets, Shopping ;Singapore, Singapore;28;1.352083;103.819836
59;HannahAnderson25;cheap price, factory outlet, outlets, display, men, clothing, quality, shirts, indonesia, shopping;50;2016/3/23;-6.882095,107.59956;I was quite amazed when I first saw Fashion World Indonesia.It has cool fashion collection and cheaper price than others factory outlet Bandung.Very comfy experience, nice service from the clerks.Reccomended for fashion and shopping lover!;357746867;Lovely Fashion Store - Fashion World Indonesia;45;Factory Outlets, Shopping ;Cupertino, California;28;37.322998;-122.032182
54;Rita T;;20;2017/10/10;-6.902923,107.59307;no neat numbering tombs so we had a bit of trouble finding our grandfather's grave, luckily many people helped us find it;531361253;make sure you know the location of your... - Ereveld Pandu Dutch Cemetery;45;Cemeteries, Historic Sites, Sights & Landmarks ;Jakarta, Indonesia;24;-6.17511;106.865039
57;Andrie S;;30;2016/1/7;-6.921595,107.61124;This monument is a symbol of asia-africa unity in KAA. This monument locate in the middle of bandung city, close enough from bandung city hall. So many people come to this place to take some picture. Sadly some of them not maintain this important monument, shame of you!;338327752;The symbol of unity - Monumen Solidaritas Asia Afrika;35;Monuments & Statues, Sights & Landmarks ;Bandung;38;-6.917464;107.619123
56;IraRahmayanti;;40;2016/2/21;-6.824506,107.437454;Its forming in a cubicle like shape, not like other Masjid (Mosque). But the more you go, you will see even more interesting things. This building has no Airconditioning system, as its no need any. The air circulation is supplied by opening/hole/bricks in its wall. the black and white hollow bricks shaped up the building, which also forming some calligraphed form. The decoration inside is even more attractive. It was designed as a green building, representing the motto of the settlement housing where it located. ;349878603;Its uncommon, but nice.. - Al-Irsyad Mosque;45;Sacred & Religious Sites, Sights & Landmarks ;Bandung, Indonesia;20;-6.917464;107.619123
56;eddyss2000;;40;2017/2/25;-6.911733,107.61102;Been here after a meeting at Maison Pine hotel, this the nearest mosque available. With its extraordinary look, this mosque gets acknowledgement coz of its design, especially inside. Its so roomier and cool. It is worth a visit for Moslem to come and pray here.;462833725;An enchanting mosque.... - Al-Irsyad Mosque;45;Sacred & Religious Sites, Sights & Landmarks ;Jakarta, Indonesia;20;-6.17511;106.865039
52;Hans K;gedung sate, typewriters, collection, stamp, knowledge, history, indonesia;40;2015/2/16;-6.90546,107.62753;Free entry and no crowd. Stamps collection was extensive including stamps from other countries. Very large room with other stamp related items (e.g. post box, envelope sorting and postal uniforms) besides stamps.However the place is quite creepy, it's not recommended if you're female and visit this place alone when it's no crowd..;254578966;If You Like Stamps, it's a must for you - Indonesia Postal Museum;40;Specialty Museums, Museums ;Chennai (Madras), India;52;13.08268;80.270718
53;TedSG1 H;water boom, playground for kids, nice place for family, family vacation, local food, carting, land, cons, scenery, saung;10;2016/12/13;-6.81753,107.59489;Water park maybe ok but I did not go. Rides and attraction do not seems to be maintained properly. When I visited, almost half of the attraction was closed. Overall the park is run down. Do not be fooled with nice pictures online.;444134727;Not worth the visit - Elephant Village;30;Theme Parks, Water & Amusement Parks ;Yogyakarta, Indonesia;320;-7.79558;110.36949
56;firmanjul;;50;2017/3/18;-6.911733,107.61102;I like the fresh air of this mosque. The area is clean. Parking area is wide enough. near from international school.;468309017;Freash Air - Al-Irsyad Mosque;45;Sacred & Religious Sites, Sights & Landmarks ;Bandung, Indonesia;20;-6.917464;107.619123
48;Regina302;;30;2016/1/19;-6.90124,107.6202;Lived not far from this park, for me this park has been transformed into modern park and nice to visit. You can jogging along the track and feel the freshness of morning air. Maybe it's quite crowded if you want to jogging at weekend, because people came here not only for jogging but also hangout with their relatives. This park have more chair to sit. I hope visitors keep the cleanliness of this park and don't litter.;341333660;To Jogging or To Hangout - Lansia Park;35;Gardens, Nature & Parks ;Bandung, Indonesia;61;-6.917464;107.619123
48;astri a;;40;2016/4/7;-6.90124,107.6202;How nice to see this park after rearranged. Free entrance.. You can exercise, sit around, looking for inspiration and even some students use this park as a place of learning. Close to the entrance of the park, there is a legendary culinary place since 1976 that yoghut Cisangkuy.;362293762;wonderful park - Lansia Park;35;Gardens, Nature & Parks ;Bandung, Indonesia;61;-6.917464;107.619123
48;babadzikra;;50;2016/2/8;-6.90124,107.6202;My kids loved this park and always ask to go to this park whenever they visit Bandung. For them the park was all about horse riding and street foods. You may bargain the price of the horse riding, normally don't pay more than IDR 15.000 per round. ;346032277;Horse and Food - Lansia Park;35;Gardens, Nature & Parks ;Jakarta, Indonesia;61;-6.17511;106.865039
46;NK_3103;factory outlet, riau street, branded items, wide range, affordable price, t shirt, worth a visit, navy, shopping, men, fashion, outfit, wear, accessories, display, batik, bargain;40;2017/1/30;-6.905872,107.61716;pretty good bargain on clothes and accessories.. there are many outlets within walking distance... you can hop from one to another ...;455912699;pretty good bargain - Heritage Factory Outlet;35;Factory Outlets, Shopping ;Singapore;111;1.352083;103.819836
46;Nikheel R;factory outlet, riau street, branded items, wide range, affordable price, t shirt, worth a visit, navy, shopping, men, fashion, outfit, wear, accessories, display, batik, bargain;40;2017/2/2;-6.905872,107.61716;A variety of choice ranging from kids to grown up ..from unbranded to branded and a lot more.it situated along the riau street and got a 4 oultets around it ..besides it is quite reasonable price when compared with others....happy shopping;456792480;This is shopping - Heritage Factory Outlet;35;Factory Outlets, Shopping ;Grand Baie;111;-20.007419;57.584421
46;Rosalina T;factory outlet, riau street, branded items, wide range, affordable price, t shirt, worth a visit, navy, shopping, men, fashion, outfit, wear, accessories, display, batik, bargain;50;2017/5/2;-6.905872,107.61716;Great shopping place with a vast range of clothes.Don't forget to check out the pop-up shop at the parking lot for more great deals and crazy discounts.;481130064;Great shopping place with a vast range... - Heritage Factory Outlet;35;Factory Outlets, Shopping ;Western Australia, Australia;111;-27.672817;121.62831
45;Wylie T;sound quality, nice place, theater, bec, pvj, mall;40;2016/2/14;-6.94121,107.5925;Go here if u on budget but wanna watch movies.. The place still cozy though but not the mall itself .. Don't get me wrong, the cinema is really comfortable :);347526024;Cheap Movie Tickets :D - CGV Blitz Miko Mall;40;Theaters, Concerts & Shows, Other ;Bandung, West Java ;49;-6.917464;107.619123
